{
    "formatVersion": "2",
    "id": 222,
    "task": "Text Analytics",
    "deployment": "production",
    "integrationType": "Integrated",
    "name": "Text Tonsorium - Advanced mode.",
    "description": "The Text Tonsorium designs and enacts workflows that fulfil your goal. Once in Text Tonsorium, you can define your goal by picking values from a few drop-down lists, e.g., annotation types in and file format of the output. Some annotation types are only available for a few languages, first and foremost Danish. In case your goal cannot be attained with the currently available tools, the Text Tonsorium will quickly let you know.",
    "logo": "texton.png",
    "homepage": "https://cst.dk/texton/help",
    "creators": "CLARIN B-centre at the University of Copenhagen, Denmark",
    "contact": {
        "person": "Bart Jongejan",
        "email": "bartj@hum.ku.dk"
    },
    "keywords": [ "lemmatization", "lemmatisation", "Part of Speech", "Dependency parsing", "Tokenisation", "Named entities", "TEI P5", "CONLL", "HTML", "JSON", "PDF", "Word", "contemporary", "late modern", "medieval", "classic", "OCR", "fraktur", "Danish" ],
    "location": "Copenhagen, Denmark",
    "authentication": "no",
    "inputs": [
        {
            "id": "text",
            "mediatypes": [
                "application/pdf",
                "application/vnd.ms-powerpoint",
                "application/vnd.openxmlformats-officedocument.presentationml.presentation",
                "application/vnd.oasis.opendocument.presentation",
                "application/vnd.ms-excel",
                "application/vnd.openxmlformats-officedocument.spreadsheetml.shee",
                "application/vnd.oasis.opendocument.spreadsheet",
                "application/x-download",
                "application/octet-stream",
                "application/msword",
                "application/vnd.oasis.opendocument.text",
                "application/vnd.openxmlformats-officedocument.wordprocessingml.document",
                "application/json",
                "application/tei+xml",
                "application/rtf",
                "application/xhtml+xml",
                "image/gif",
                "image/jpeg",
                "image/pjpeg",
                "image/png",
                "image/tiff",
                "image/vnd.microsoft.icon",
                "image/svg+xml",
                "text/html",
                "text/plain",
                "text/rtf",
                "text/x-conll",
                "text/xml"
            ],
            "languages": [ "afr", "ara", "ast", "bel", "bos", "bre", "bul", "cat", "ces", "chu", "cop", "cos", "cym", "dan", "deu", "ell", "eng", "epo", "est", "eus", "fao", "fas", "fin", "fra", "gla", "gle", "glg", "glv", "gml", "got", "hat", "heb", "hin", "hrv", "hun", "hye", "iku", "ind", "isl", "ita", "jav", "jpn", "kan", "kat", "kor", "kur", "lat", "lav", "lit", "ltz", "mal", "mar", "mkd", "mlt", "msa", "nld", "nno", "nob", "nor", "oci", "pol", "por", "ron", "rus", "slk", "slv", "sme", "spa", "sqi", "srp", "swa", "swe", "tam", "tel", "tur", "uig", "ukr", "urd", "uzb", "vie", "wol", "yid", "zho" ],
            "maxSize": 40960000,
            "multiple": true
        }
    ],
    "webApplication": {
        "url": "https://cst.dk/texton/specifyGoal",
        "queryParameters": [
            {
                "name": "URLS",
                "bind": "text/dataurl"
            },
            {
                "name": "Ilang",
                "bind": "text/language",
                "encoding": "639-3"
            },
            {
                "name": "Olang",
                "bind": "text/language",
                "encoding": "639-3"
            },
            {
                "name": "UIlanguage",
                "value": "en"
            },
            {
                "name": "Ifacet",
                "value": "txt"
            },
            {
                "name": "Iambig",
                "value": "una"
            },
            {
                "name": "Iapp",
                "value": "nrm"
            }
        ]
    }
}
