{
    "formatVersion": "2",
    "id": 139,
    "task": "Sentiment Analysis",
    "deployment": "production",
    "integrationType": "Integrated",
    "name": "MultiEmo",
    "description": "Tool for the multilingual sentiment analysis of texts.",
    "logo": "clarin-pl.png",
    "homepage": "https://services.clarin-pl.eu/services/multiemo",
    "creators": "Clarin-PL",
    "contact": {
        "person": "Tomasz Walkowiak",
        "email": "tomasz.walkowiak@pwr.edu.pl"
    },
    "keywords": ["topic", "topic modelling", "LDA", "text analysis"],
    "location": "Wroclaw, Poland",
    "authentication": "Yes, user should create an account on the Clarin-PL website",
    "inputs": [{
        "id": "text",
        "mediatypes": ["application/zip"],
        "languages": ["eng", "pol", "deu", "spa", "fra", "ita", "nld", "por", "rus", "jpn"]
    }],
    "webApplication": {
        "url": "https://services.clarin-pl.eu/services/multiemo/creator",
        "queryParameters": [{
            "name": "weblicht-input",
            "bind": "text/dataurl"
        }]
    }
}
