{
    "formatVersion": "2",
    "id": 88,
    "task": "Keyword Extractor",
    "deployment": "production",
    "integrationType": "Integrated",
    "name": "Keytool",
    "description": "Service integrates several keyword determination methods, including generative models and multi-label classification. The combination of several advanced techniques makes the results more reliable and accurate.",
    "logo": "clarin-pl.png",
    "homepage": "https://services.clarin-pl.eu/services/keytool",
    "creators": "Clarin-PL",
    "contact": {
        "person": "Tomasz Walkowiak",
        "email": "tomasz.walkowiak@pwr.edu.pl"
    },
    "keywords": ["keyword extraction", "keyword determination"],
    "location": "Wroclaw, Poland",
    "authentication": "Yes, user should create an account on the Clarin-PL website",
    "inputs": [{
        "id": "text",
        "mediatypes": ["application/zip"],
        "languages": ["eng", "pol"]
    }],
    "webApplication": {
        "url": "https://services.clarin-pl.eu/services/keytool/creator",
        "queryParameters": [{
            "name": "weblicht-input",
            "bind": "text/dataurl"
        }]
    }
}
