{
    "id": 150,
    "formatVersion": "2",
    "task": "Topic Modelling",
    "deployment": "production",
    "integrationType": "Local",
    "name": "TopicsExplorer",
    "logo": "dariah-de.svg",
    "homepage": "https://dariah-de.github.io/TopicsExplorer/",
    "description": "The Topicsexplorer is a beginner-oriented Software allowing interested researchers to experiment with topic modeling on their own computers, with their own text corpora.",
    "location": "",
    "creators": "",
    "contact": {
        "email": "info@de.dariah.eu"
    },
    "inputs": [
        {
            "id": "input",
            "mediatypes": [
                "text/plain",
                "text/xml"
            ],
            "languages": "generic"
        }
    ],
    "standaloneApplication": {
        "downloadURL": [
            {
                "url": "https://github.com/DARIAH-DE/TopicsExplorer/releases/tag/v2.0",
                "type": "release"
            },
            {
                "url": "https://github.com/DARIAH-DE/TopicsExplorer/releases/tag/v2.0",
                "type": "preview"
            }
        ],
        "applicationSuite": "TopicsExplorer",
        "licenseInformation": [
            "Apache License, Version 2.0"
        ]
    },
    "authentication": null,
    "keywords": [
        "Topic modeling"
    ],
    "usageRestrictions": {
        "individualUserRestrictions": "academic"
    }
}
