{
    "formatVersion": "2",
    "id": 90,
    "task": "Editing",
    "deployment": "production",
    "integrationType": "Integrated",
    "name": "TxTParaphrase",
    "description": "Based on a deep language model that analyzes the semantic content of statements and generates texts with the same meaning but with a changed form. The tool returns text of a similar length to the text entered by the user.",
    "logo": "clarin-pl.png",
    "homepage": "https://services.clarin-pl.eu/services/paraphrase",
    "creators": "Clarin-PL",
    "contact": {
        "person": "Tomasz Walkowiak",
        "email": "tomasz.walkowiak@pwr.edu.pl"
    },
    "keywords": ["paraphrase", "text", "semantic content"],
    "location": "Wroclaw, Poland",
    "authentication": "Yes, user should create an account on the Clarin-PL website",
    "inputs": [{
        "id": "text",
        "mediatypes": ["application/zip"],
        "languages": ["eng", "pol"]
    }],
    "webApplication": {
        "url": "https://services.clarin-pl.eu/services/paraphrase/creator",
        "queryParameters": [{
            "name": "weblicht-input",
            "bind": "text/dataurl"
        }]
    }
}
