{
    "formatVersion": "2",
    "id": 191,
    "task": "Editing",
    "deployment": "production",
    "integrationType": "Integrated",
    "name": "Dewulgaryzator",
    "description": "Service that allows you to replace vulgar expressions with their non-vulgar equivalents while maintaining the original character of the text.",
    "logo": "clarin-pl.png",
    "homepage": "https://services.clarin-pl.eu/services/txt2txt",
    "creators": "Clarin-PL",
    "contact": {
        "person": "Tomasz Walkowiak",
        "email": "tomasz.walkowiak@pwr.edu.pl"
    },
    "keywords": ["profanity", "substitution", "vulgar"],
    "location": "Wroclaw, Poland",
    "authentication": "Yes, user should create an account on the Clarin-PL website",
    "inputs": [{
        "id": "text",
        "mediatypes": ["application/zip"],
        "languages": ["pol"]
    }],
    "webApplication": {
        "url": "https://services.clarin-pl.eu/services/txt2txt/creator",
        "queryParameters": [{
            "name": "weblicht-input",
            "bind": "text/dataurl"
        }]
    }
}
