{
    "formatVersion": "2",
    "id": 51,
    "task": "Editing",
    "deployment": "production",
    "integrationType": "Integrated",
    "name": "Anonymizer",
    "description": "Anonymized data is not subject to GDPR and does not pose any other threats to privacy - so it can be archived without risk and freely transferred between departments or to external companies without the use of trustee agreements.",
    "logo": "clarin-pl.png",
    "homepage": "https://services.clarin-pl.eu/services/anonymizer",
    "creators": "Clarin-PL",
    "contact": {
        "person": "Tomasz Walkowiak",
        "email": "tomasz.walkowiak@pwr.edu.pl"
    },
    "keywords": ["anonymization", "gdpr", "rodo", "privacy", "data protection", "personal data", "data security"],
    "location": "Wroclaw, Poland",
    "authentication": "Yes, user should create an account on the Clarin-PL website",
    "inputs": [{
        "id": "text",
        "mediatypes": ["application/zip"],
        "languages": ["eng", "pol"]
    }],
    "webApplication": {
        "url": "https://services.clarin-pl.eu/services/anonymizer/creator",
        "queryParameters": [{
            "name": "weblicht-input",
            "bind": "text/dataurl"
        }]
    }
}
