{
    "formatVersion": "2",
    "id": 111,
    "task": "Visualisation of Geographic Data",
    "deployment": "production",
    "integrationType": "Integrated",
    "name": "Dewulgaryzator",
    "description": "Tool based on the Named Entity Recognition service, assigning geographic coordinates to detected place names.",
    "logo": "clarin-pl.png",
    "homepage": "https://services.clarin-pl.eu/services/geolocation",
    "creators": "Clarin-PL",
    "contact": {
        "person": "Tomasz Walkowiak",
        "email": "tomasz.walkowiak@pwr.edu.pl"
    },
    "keywords": ["geolocation", "named entity recognition", "place names", "geographic coordinates"],
    "location": "Wroclaw, Poland",
    "authentication": "Yes, user should create an account on the Clarin-PL website",
    "inputs": [{
        "id": "text",
        "mediatypes": ["application/zip"],
        "languages": ["pol", "eng"]
    }],
    "webApplication": {
        "url": "https://services.clarin-pl.eu/services/geolocation/creator",
        "queryParameters": [{
            "name": "weblicht-input",
            "bind": "text/dataurl"
        }]
    }
}
